{
  "schemaVersion": "0.1",
  "id": "receipt.fe588829df2fef6dc674e4c1",
  "capabilityId": "github.pymupdf.pymupdf",
  "taskId": "community.pdf.borderless-multiline-table.v1",
  "status": "error",
  "recordedAt": "2026-08-27T22:51:40.619432+00:00",
  "environment": {
    "os": "Windows-11-10.0.26200-SP0",
    "architecture": "AMD64",
    "python": "3.12.13"
  },
  "execution": {
    "toolVersion": "1.26.7",
    "durationSeconds": 3.40653,
    "networkUsed": false
  },
  "metrics": {
    "cellAccuracy": 0.0,
    "rowCount": 0,
    "columnCount": 0,
    "peakMemoryMiB": 14.317
  },
  "artifacts": [
    {
      "role": "input",
      "path": "fixtures/pdf-borderless-multiline/input.pdf",
      "sha256": "a15cb269ab5ffe800c5b1685875599f722324e54804f3abbce8a5fda2c476a12"
    },
    {
      "role": "output",
      "path": "receipts/artifacts/sha256-e3b0c44298fc1c149afbf4c8996fb92427ae41e4649b934ca495991b7852b855.csv",
      "sha256": "e3b0c44298fc1c149afbf4c8996fb92427ae41e4649b934ca495991b7852b855"
    }
  ],
  "notes": "RuntimeError: PyMuPDF detected no table"
}
