{
  "schemaVersion": "0.1",
  "id": "receipt.c443949e7aa9a340b66d20fb",
  "capabilityId": "github.pymupdf.pymupdf",
  "taskId": "community.pdf.multipage-repeated-header.v1",
  "status": "passed",
  "pipelineId": "drop-repeated-headers.v1",
  "transformations": [
    "drop-repeated-headers.v1"
  ],
  "recordedAt": "2026-08-28T23:41:50.286051+00:00",
  "environment": {
    "os": "Windows-11-10.0.26200-SP0",
    "architecture": "AMD64",
    "python": "3.12.13"
  },
  "execution": {
    "toolVersion": "1.26.7",
    "durationSeconds": 1.724262,
    "networkUsed": false
  },
  "metrics": {
    "cellAccuracy": 1.0,
    "rowCount": 13,
    "columnCount": 6,
    "peakMemoryMiB": 14.221
  },
  "artifacts": [
    {
      "role": "input",
      "path": "fixtures/pdf-multipage-procurement/input.pdf",
      "sha256": "805512e2f59822cf20c8185c71fb0d7390ed3714de264d91cec704bf95f3bea8"
    },
    {
      "role": "intermediate",
      "path": "receipts/artifacts/sha256-e518cd348187b98874d6c907184c0dea41d36ba377a998b640cba633955aa1b4.csv",
      "sha256": "e518cd348187b98874d6c907184c0dea41d36ba377a998b640cba633955aa1b4"
    },
    {
      "role": "output",
      "path": "receipts/artifacts/sha256-b7b6e64620d9ec4d06341cccf9f41191ee0b079774a5b051e1220552d284aa83.csv",
      "sha256": "b7b6e64620d9ec4d06341cccf9f41191ee0b079774a5b051e1220552d284aa83"
    }
  ],
  "notes": "Executed by the pymupdf adapter using default detection with text-alignment fallback."
}
