{
  "schemaVersion": "0.1",
  "id": "receipt.7c32da509504c19773df8cab",
  "capabilityId": "github.camelot-dev.camelot",
  "taskId": "community.pdf.multipage-repeated-header.v1",
  "status": "failed",
  "pipelineId": "raw",
  "transformations": [],
  "recordedAt": "2026-08-28T23:41:47.471973+00:00",
  "environment": {
    "os": "Windows-11-10.0.26200-SP0",
    "architecture": "AMD64",
    "python": "3.12.13"
  },
  "execution": {
    "toolVersion": "2.0.0",
    "durationSeconds": 8.826831,
    "networkUsed": false
  },
  "metrics": {
    "cellAccuracy": 0.0,
    "rowCount": 21,
    "columnCount": 8,
    "peakMemoryMiB": 119.641
  },
  "artifacts": [
    {
      "role": "input",
      "path": "fixtures/pdf-multipage-procurement/input.pdf",
      "sha256": "805512e2f59822cf20c8185c71fb0d7390ed3714de264d91cec704bf95f3bea8"
    },
    {
      "role": "output",
      "path": "receipts/artifacts/sha256-9864fe8c6575d90d60a8dda59aba18e8b72a0e84914d1f6765bc86fb1be01f12.csv",
      "sha256": "9864fe8c6575d90d60a8dda59aba18e8b72a0e84914d1f6765bc86fb1be01f12"
    }
  ],
  "notes": "Executed by the camelot adapter using default detection with text-alignment fallback."
}
