{
  "schemaVersion": "0.1",
  "id": "receipt.61e7b15e4e2792d452d117f8",
  "capabilityId": "github.camelot-dev.camelot",
  "taskId": "community.pdf.borderless-multiline-table.v1",
  "status": "failed",
  "pipelineId": "raw",
  "transformations": [],
  "recordedAt": "2026-08-27T23:04:32.548248+00:00",
  "environment": {
    "os": "Windows-11-10.0.26200-SP0",
    "architecture": "AMD64",
    "python": "3.12.13"
  },
  "execution": {
    "toolVersion": "2.0.0",
    "durationSeconds": 5.101431,
    "networkUsed": false
  },
  "metrics": {
    "cellAccuracy": 0.222222,
    "rowCount": 9,
    "columnCount": 6,
    "peakMemoryMiB": 50.186
  },
  "artifacts": [
    {
      "role": "input",
      "path": "fixtures/pdf-borderless-multiline/input.pdf",
      "sha256": "a15cb269ab5ffe800c5b1685875599f722324e54804f3abbce8a5fda2c476a12"
    },
    {
      "role": "output",
      "path": "receipts/artifacts/sha256-1711b6ccfede5effa99cbb0213919930b2b9d0614de05d83660391799be67f99.csv",
      "sha256": "1711b6ccfede5effa99cbb0213919930b2b9d0614de05d83660391799be67f99"
    }
  ],
  "notes": "Executed by the camelot adapter using default detection with text-alignment fallback."
}
