{
  "schemaVersion": "0.1",
  "id": "receipt.03ccbf5f227037db587e0d3c",
  "capabilityId": "github.camelot-dev.camelot",
  "taskId": "community.pdf.multipage-repeated-header.v1",
  "status": "failed",
  "pipelineId": "drop-repeated-headers.v1",
  "transformations": [
    "drop-repeated-headers.v1"
  ],
  "recordedAt": "2026-08-28T23:41:52.891423+00:00",
  "environment": {
    "os": "Windows-11-10.0.26200-SP0",
    "architecture": "AMD64",
    "python": "3.12.13"
  },
  "execution": {
    "toolVersion": "2.0.0",
    "durationSeconds": 2.54561,
    "networkUsed": false
  },
  "metrics": {
    "cellAccuracy": 0.0,
    "rowCount": 16,
    "columnCount": 8,
    "peakMemoryMiB": 119.64
  },
  "artifacts": [
    {
      "role": "input",
      "path": "fixtures/pdf-multipage-procurement/input.pdf",
      "sha256": "805512e2f59822cf20c8185c71fb0d7390ed3714de264d91cec704bf95f3bea8"
    },
    {
      "role": "intermediate",
      "path": "receipts/artifacts/sha256-9864fe8c6575d90d60a8dda59aba18e8b72a0e84914d1f6765bc86fb1be01f12.csv",
      "sha256": "9864fe8c6575d90d60a8dda59aba18e8b72a0e84914d1f6765bc86fb1be01f12"
    },
    {
      "role": "output",
      "path": "receipts/artifacts/sha256-66df85c8141dad37feefaeb61234486039cc804c36959af88a3ab5c8ba163f5e.csv",
      "sha256": "66df85c8141dad37feefaeb61234486039cc804c36959af88a3ab5c8ba163f5e"
    }
  ],
  "notes": "Executed by the camelot adapter using default detection with text-alignment fallback."
}
