{
  "schemaVersion": "0.1",
  "id": "receipt.827a739faa7dec78f81d7383",
  "capabilityId": "github.pdfplumber.pdfplumber",
  "taskId": "community.pdf.borderless-multiline-table.v1",
  "status": "failed",
  "recordedAt": "2026-08-27T22:53:18.213668+00:00",
  "environment": {
    "os": "Windows-11-10.0.26200-SP0",
    "architecture": "AMD64",
    "python": "3.12.13"
  },
  "execution": {
    "toolVersion": "0.11.10",
    "durationSeconds": 0.699833,
    "networkUsed": false
  },
  "metrics": {
    "cellAccuracy": 0.066667,
    "rowCount": 15,
    "columnCount": 6,
    "peakMemoryMiB": 6.511
  },
  "artifacts": [
    {
      "role": "input",
      "path": "fixtures/pdf-borderless-multiline/input.pdf",
      "sha256": "a15cb269ab5ffe800c5b1685875599f722324e54804f3abbce8a5fda2c476a12"
    },
    {
      "role": "output",
      "path": "receipts/artifacts/sha256-64fabd874d0d3d615d0b91241839cc6ff03fee19f127ad37b0165c263fdd964c.csv",
      "sha256": "64fabd874d0d3d615d0b91241839cc6ff03fee19f127ad37b0165c263fdd964c"
    }
  ],
  "notes": "Executed by the pdfplumber adapter using default detection with text-alignment fallback."
}
